title,year,rating,date_rated,duration,director,country,genre,image,summary
2001: A Space Odyssey,1968,9,Rated on 01 Apr 2016,2h 29min,Stanley Kubrick,"UK,USA"," Adventure, Sci-Fi","https://m.media-amazon.com/images/M/MV5BMmNlYzRiNDctZWNhMi00MzI4LThkZTctMTUzMmZkMmFmNThmXkEyXkFqcGdeQXVyNzkwMjQ5NzM@._V1_UX182_CR0,0,182,268_AL_.jpg","After discovering a mysterious artifact buried beneath the Lunar surface, mankind sets off on a quest to find its origins with help from intelligent supercomputer H.A.L. 9000."
City of God,2002,8,Rated on 03 Apr 2016,2h 10min,"Fernando Meirelles,Kátia Lund","Brazil,France,Germany"," Crime, Drama","https://m.media-amazon.com/images/M/MV5BNDJiNTEwMjMtOGQ1ZC00OTczLWFjZjctZWQ0MGJjZmFkMjcwXkEyXkFqcGdeQXVyNjU0OTQ0OTY@._V1_UX182_CR0,0,182,268_AL_.jpg","In the slums of Rio, two kids' paths diverge as one struggles to become a photographer and the other a kingpin."
And Now for Something Completely Different,1971,7,Rated on 01 Apr 2016,1h 28min,Ian MacNaughton,UK, Comedy,"https://m.media-amazon.com/images/M/MV5BYWQzYjU5ODAtNDY5Yy00ZDIxLWJlMTEtOWRkMjlkNTdmMTBhXkEyXkFqcGdeQXVyNjE5MjUyOTM@._V1_UX182_CR0,0,182,268_AL_.jpg",An anthology of the best sketches from the first and second seasons of
Touch of Evil,1958,7,Rated on 11 Apr 2016,1h 35min,Orson Welles,USA," Crime, Drama, Film-Noir, Thriller","https://m.media-amazon.com/images/M/MV5BOTA1MjA3M2EtMmJjZS00OWViLTkwMTEtM2E5ZDk0NTAyNGJiXkEyXkFqcGdeQXVyNzkwMjQ5NzM@._V1_UX182_CR0,0,182,268_AL_.jpg","A stark, perverse story of murder, kidnapping, and police corruption in a Mexican border town."
Drive,2011,7,Rated on 03 Apr 2016,1h 40min,Nicolas Winding Refn,USA," Crime, Drama","https://m.media-amazon.com/images/M/MV5BZjY5ZjQyMjMtMmEwOC00Nzc2LTllYTItMmU2MzJjNTg1NjY0XkEyXkFqcGdeQXVyNjQ1MTMzMDQ@._V1_UX182_CR0,0,182,268_AL_.jpg",A mysterious Hollywood stuntman and mechanic moonlights as a getaway driver and finds himself in trouble when he helps out his neighbor in this action drama.
BoJack Horseman,,8,Rated on 06 Apr 2016,25min,Raphael Bob-Waksberg,USA," Animation, Comedy, Drama","https://m.media-amazon.com/images/M/MV5BYWQwMDNkM2MtODU4OS00OTY3LTgwOTItNjE2Yzc0MzRkMDllXkEyXkFqcGdeQXVyMTkxNjUyNQ@@._V1_UX182_CR0,0,182,268_AL_.jpg","BoJack Horseman was the star of the hit television show ""Horsin' Around"" in the '80s and '90s, now he's washed up, living in Hollywood, complaining about everything, and wearing colorful sweaters."
Alien,1979,8,Rated on 17 Apr 2016,1h 57min,Ridley Scott,"UK,USA"," Horror, Sci-Fi","https://m.media-amazon.com/images/M/MV5BMmQ2MmU3NzktZjAxOC00ZDZhLTk4YzEtMDMyMzcxY2IwMDAyXkEyXkFqcGdeQXVyNzkwMjQ5NzM@._V1_UX182_CR0,0,182,268_AL_.jpg","After a space merchant vessel perceives an unknown transmission as a distress call, its landing on the source moon finds one of the crew attacked by a mysterious lifeform, and they soon realize that its life cycle has merely begun."
The Master,2012,8,Rated on 02 Apr 2016,2h 18min,Paul Thomas Anderson,USA, Drama,"https://m.media-amazon.com/images/M/MV5BMTQ2NjQ5MzMwMF5BMl5BanBnXkFtZTcwMjczNTAzOA@@._V1_UX182_CR0,0,182,268_AL_.jpg",A Naval veteran arrives home from war unsettled and uncertain of his future - until he is tantalized by the Cause and its charismatic leader.
The Wolfpack,2015,6,Rated on 18 Apr 2016,1h 30min,Crystal Moselle,USA," Documentary, Biography","https://m.media-amazon.com/images/M/MV5BMzg2NjE5OTQwNl5BMl5BanBnXkFtZTgwNjYwNDk2NTE@._V1_UX182_CR0,0,182,268_AL_.jpg","Confined in an apartment from a New York housing project, the six Angulo brothers learned everything they know about the world through watching films and spend their time reenacting their favorite movies with intricate homemade costumes."
Monty Python and the Holy Grail,1975,8,Rated on 24 Apr 2016,1h 31min,"Terry Gilliam,Terry Jones",UK," Adventure, Comedy, Fantasy","https://m.media-amazon.com/images/M/MV5BN2IyNTE4YzUtZWU0Mi00MGIwLTgyMmQtMzQ4YzQxYWNlYWE2XkEyXkFqcGdeQXVyNjU0OTQ0OTY@._V1_UX182_CR0,0,182,268_AL_.jpg","King Arthur and his Knights of the Round Table embark on a surreal, low-budget search for the Holy Grail, encountering many, very silly obstacles."
Fawlty Towers,,8,Rated on 17 Apr 2016,30min,"John Cleese,Prunella Scales,Andrew Sachs,See full cast & crew",UK, Comedy,"https://m.media-amazon.com/images/M/MV5BYzc3MTQyYzMtMWY4Ny00N2RiLWI3ZDYtOWRlYjUxZDllMjQxXkEyXkFqcGdeQXVyNzkwMjQ5NzM@._V1_UX182_CR0,0,182,268_AL_.jpg","Hotel owner Basil Fawlty's incompetence, short fuse, and arrogance form a combination that ensures accidents and trouble are never far away."
Rashomon,1950,8,Rated on 01 May 2016,1h 28min,Akira Kurosawa,Japan," Crime, Drama, Mystery","https://m.media-amazon.com/images/M/MV5BMTk1MDU5MjQ5NF5BMl5BanBnXkFtZTgwMDM2OTE4MzE@._V1_UY268_CR3,0,182,268_AL_.jpg","The rape of a bride and the murder of her samurai husband are recalled from the perspectives of a bandit, the bride, the samurai's ghost and a woodcutter."
Ran,1985,10,Rated on 01 May 2016,2h 42min,Akira Kurosawa,"Japan,France"," Action, Drama","https://m.media-amazon.com/images/M/MV5BZDBjZTM4ZmEtOTA5ZC00NTQzLTkyNzYtMmUxNGU2YjI5YjU5L2ltYWdlXkEyXkFqcGdeQXVyNTAyODkwOQ@@._V1_UY268_CR3,0,182,268_AL_.jpg","In Medieval Japan, an elderly warlord retires, handing over his empire to his three sons. However, he vastly underestimates how the new-found power will corrupt them and cause them to turn on each other...and him."
Zootopia,2016,5,Rated on 11 Apr 2016,1h 48min,"Byron Howard,Rich Moore,1 more credit",USA," Animation, Adventure, Comedy, Crime, Family, Mystery","https://m.media-amazon.com/images/M/MV5BOTMyMjEyNzIzMV5BMl5BanBnXkFtZTgwNzIyNjU0NzE@._V1_UX182_CR0,0,182,268_AL_.jpg","In a city of anthropomorphic animals, a rookie bunny cop and a cynical con artist fox must work together to uncover a conspiracy."
Monty Python's Life of Brian,1979,8,Rated on 01 May 2016,1h 34min,Terry Jones,UK, Comedy,"https://m.media-amazon.com/images/M/MV5BMzAwNjU1OTktYjY3Mi00NDY5LWFlZWUtZjhjNGE0OTkwZDkwXkEyXkFqcGdeQXVyMTQxNzMzNDI@._V1_UX182_CR0,0,182,268_AL_.jpg","Born on the original Christmas in the stable next door to Jesus, Brian of Nazareth spends his life being mistaken for a messiah."
Ponyo,2008,8,Rated on 26 Jun 2016,1h 41min,Hayao Miyazaki,Japan," Animation, Adventure, Comedy, Family, Fantasy","https://m.media-amazon.com/images/M/MV5BMjA5NzkxNTg2MF5BMl5BanBnXkFtZTcwMTA3MjU1Mg@@._V1_UX182_CR0,0,182,268_AL_.jpg","A five-year-old boy develops a relationship with Ponyo, a young goldfish princess who longs to become a human after falling in love with him."
Broken Flowers,2005,8,Rated on 28 Jun 2016,1h 46min,Jim Jarmusch,"France,USA"," Comedy, Drama, Mystery, Romance","https://m.media-amazon.com/images/M/MV5BMTQ4OTk1MTYxM15BMl5BanBnXkFtZTcwMTYwNjAzMQ@@._V1_UX182_CR0,0,182,268_AL_.jpg","As the extremely withdrawn Don Johnston is dumped by his latest woman, he receives an anonymous letter from a former lover informing him that he has a son who may be looking for him. A freelance sleuth neighbor moves Don to embark on a cross-country search for his old flames in search of answers."
Orpheus,1950,8,Rated on 02 Jul 2016,1h 35min,Jean Cocteau,France," Fantasy, Drama, Romance","https://m.media-amazon.com/images/M/MV5BMTUwMjUwMTY2MV5BMl5BanBnXkFtZTgwNzA2MDM5MTE@._V1_UY268_CR8,0,182,268_AL_.jpg",A poet in love with Death follows his unhappy wife into the underworld.
Moon,2009,8,Rated on 21 Jun 2016,1h 37min,Duncan Jones,"UK,USA"," Drama, Mystery, Sci-Fi","https://m.media-amazon.com/images/M/MV5BMTgzODgyNTQwOV5BMl5BanBnXkFtZTcwNzc0NTc0Mg@@._V1_UX182_CR0,0,182,268_AL_.jpg","Astronaut Sam Bell has a quintessentially personal encounter toward the end of his three-year stint on the Moon, where he, working alongside his computer, GERTY, sends back to Earth parcels of a resource that has helped diminish our planet's power problems."
A Day in the Country,1946,7,Rated on 30 Jun 2016,40min,Jean Renoir,France," Short, Comedy, Drama, Romance","https://m.media-amazon.com/images/M/MV5BMTFmMzgwMWEtMDVlNy00MDdhLWJjODEtZjU3MTY3MzhhMjZmXkEyXkFqcGdeQXVyNjI5NTk0MzE@._V1_UY268_CR9,0,182,268_AL_.jpg","The family of a Parisian shop-owner spends a day in the country. The daughter falls in love with a man at the inn, where they spend the day."
Mystery Train,1989,8,Rated on 25 Apr 2016,1h 50min,Jim Jarmusch,"Japan,USA"," Comedy, Crime, Drama","https://m.media-amazon.com/images/M/MV5BNjcyMDYyM2ItYzFlNy00N2FmLTljNTAtODllZjZhNWIwMTVlXkEyXkFqcGdeQXVyNzM0MTUwNTY@._V1_UX182_CR0,0,182,268_AL_.jpg",Three stories are connected by a Memphis hotel and the spirit of Elvis Presley.
Zodiac,2007,7,Rated on 10 Jul 2016,2h 37min,David Fincher,USA," Crime, Drama, Mystery, Thriller","https://m.media-amazon.com/images/M/MV5BN2UwNDc5NmEtNjVjZS00OTI5LWE5YjctMWM3ZjBiZGYwMGI2XkEyXkFqcGdeQXVyNzkwMjQ5NzM@._V1_UX182_CR0,0,182,268_AL_.jpg","In the late 1960s/early 1970s, a San Francisco cartoonist becomes an amateur detective obsessed with tracking down the Zodiac Killer, an unidentified individual who terrorizes Northern California with a killing spree."
Vivre Sa Vie,1962,8,Rated on 09 Jul 2016,1h 25min,Jean-Luc Godard,France, Drama,"https://m.media-amazon.com/images/M/MV5BNjMyZmI5NmItY2JlMi00NzU3LWI5ZGItZjhkOTE0YjEyN2Q4XkEyXkFqcGdeQXVyNDkzNTM2ODg@._V1_UX182_CR0,0,182,268_AL_.jpg",Twelve episodic tales in the life of a Parisian woman and her slow descent into prostitution.
L'Avventura,1960,7,Rated on 03 Jul 2016,2h 24min,Michelangelo Antonioni,"Italy,France"," Drama, Mystery","https://m.media-amazon.com/images/M/MV5BMWM4NTE1NzktNzg3Yi00ZTgxLWI3ZjctMTM0MjY3YTRiNzRhXkEyXkFqcGdeQXVyNTc1NDM0NDU@._V1_UY268_CR3,0,182,268_AL_.jpg","A woman disappears during a Mediterranean boating trip. During the search, her lover and her best friend become attracted to each other."
Ghost Dog: The Way of the Samurai,1999,8,Rated on 11 Jul 2016,1h 56min,Jim Jarmusch,"France,Germany,USA,Japan"," Action, Crime, Drama, Thriller","https://m.media-amazon.com/images/M/MV5BZWQxZTJmN2YtMjdmMS00ZTFmLTk5ZDYtODA4ZDA1YWQ2MjMyL2ltYWdlL2ltYWdlXkEyXkFqcGdeQXVyNjU0OTQ0OTY@._V1_UX182_CR0,0,182,268_AL_.jpg",An African-American Mafia hit man who models himself after the samurai of old finds himself targeted for death by the mob.
Cobra Verde,1987,6,Rated on 04 Jul 2016,1h 51min,Werner Herzog,"West Germany,Ghana"," Adventure, Drama","https://m.media-amazon.com/images/M/MV5BNDcyZjExNTUtOTk3YS00NThhLWEyZmItZjNhOWJiNjQ0MGNiXkEyXkFqcGdeQXVyNzgzODI1OTE@._V1_UY268_CR9,0,182,268_AL_.jpg","During the 1800s, paroled Brazilian bandit Cobra Verde is sent to West Africa with a few troops to man an old Portuguese fort and to convince the local African ruler to resume the slave trade with Brazil."
Three Businessmen,1998,7,Rated on 09 Jul 2016,1h 20min,Alex Cox,"UK,Japan,USA,Netherlands"," Comedy, Drama","https://m.media-amazon.com/images/M/MV5BYjUyNTBlNGQtMzNmZC00ZGU4LWExYTYtZWE3ZTNiODkwM2JhXkEyXkFqcGdeQXVyNTM3MDMyMDQ@._V1_UY268_CR9,0,182,268_AL_.jpg","An American art dealer (Miguel Sandoval), who specializes in southwestern topaz, arrives by train in Liverpool. Similarly, a very proper British art dealer (Alex Cox), who specializes in ..."
Germany Year Zero,1948,8,Rated on 11 Jul 2016,1h 18min,Roberto Rossellini,"Italy,France,Germany"," Drama, War","https://m.media-amazon.com/images/M/MV5BMDRlOWRiMTktYmQ0Zi00ZDRhLWIwNjUtYmM1MDA0MjZiZjlmXkEyXkFqcGdeQXVyMjgyNjk3MzE@._V1_UX182_CR0,0,182,268_AL_.jpg",A young German boy faces the problems of the tough life in the immediate post WWII Berlin.
Ratcatcher,1999,8,Rated on 10 Jul 2016,1h 34min,Lynne Ramsay,"UK,France", Drama,"https://m.media-amazon.com/images/M/MV5BMTk4MWQ5MmEtNTk1MS00NGNkLWE1NTQtYTJlZTZmOTExOTcxXkEyXkFqcGdeQXVyMTMxMTY0OTQ@._V1_UX182_CR0,0,182,268_AL_.jpg","An unabashed kid navigates the filthy world of 1973 Glasgow, preoccupying himself with the equally poor youth around him."
Mustang,2015,7,Rated on 25 Jul 2016,1h 37min,Deniz Gamze Ergüven,"Turkey,France,Germany,Qatar", Drama,"https://m.media-amazon.com/images/M/MV5BMTkwODUzODA0OV5BMl5BanBnXkFtZTgwMTA3ODkxNzE@._V1_UY268_CR2,0,182,268_AL_.jpg","When five orphan girls are seen innocently playing with boys on a beach, their scandalized conservative guardians confine them while forced marriages are arranged."
The Third Man,1949,9,Rated on 17 Jul 2016,1h 33min,Carol Reed,UK," Film-Noir, Mystery, Thriller","https://m.media-amazon.com/images/M/MV5BYjE2OTdhMWUtOGJlMy00ZDViLWIzZjgtYjZkZGZmMDZjYmEyXkEyXkFqcGdeQXVyNzkwMjQ5NzM@._V1_UX182_CR0,0,182,268_AL_.jpg","Pulp novelist Holly Martins travels to shadowy, postwar Vienna, only to find himself investigating the mysterious death of an old friend, Harry Lime."
Onibaba,1964,8,Rated on 01 Aug 2016,1h 43min,Kaneto Shindô,Japan," Drama, Horror","https://m.media-amazon.com/images/M/MV5BMWRiYmNmNTEtM2FlNC00ODRlLWFiMmQtYmNlNzgxY2MzMzNkL2ltYWdlXkEyXkFqcGdeQXVyNjc1NTYyMjg@._V1_UY268_CR2,0,182,268_AL_.jpg","Two women kill samurai and sell their belongings for a living. While one of them is having an affair with their neighbor, the other woman meets a mysterious samurai wearing a bizarre mask."
The Squid and the Whale,2005,8,Rated on 17 Jul 2016,1h 21min,Noah Baumbach,USA," Comedy, Drama","https://m.media-amazon.com/images/M/MV5BMjU0MzBiMDctMmU3NS00NjRkLTkzMzgtZWE3NmExZGI0MmVhXkEyXkFqcGdeQXVyMTMxODk2OTU@._V1_UX182_CR0,0,182,268_AL_.jpg",Follows two young boys dealing with their parents' divorce in Brooklyn in the 1980s.
Throne of Blood,1957,8,Rated on 18 Jul 2016,1h 50min,Akira Kurosawa,Japan," Drama, History","https://m.media-amazon.com/images/M/MV5BNGYxZjA2M2ItYTRmNS00NzRmLWJkYzgtYTdiNGFlZDI5ZjNmXkEyXkFqcGdeQXVyNDE5MTU2MDE@._V1_UY268_CR1,0,182,268_AL_.jpg","A war-hardened general, egged on by his ambitious wife, works to fulfill a prophecy that he would become lord of Spider's Web Castle."
The Hard Stop,2015,7,Rated on 22 Jul 2016,1h 25min,"George Amponsah,George Amponsah",UK," Documentary, Action, Crime, Drama","https://m.media-amazon.com/images/M/MV5BZjFmM2NiNTEtNmU1Zi00MDA5LWI5ZWItZWZjMmU5OWQwN2QyL2ltYWdlXkEyXkFqcGdeQXVyMTM0NTM0ODY@._V1_UX182_CR0,0,182,268_AL_.jpg","The police killing of Mark Duggan in London, 2011, ignited the worst civil unrest in recent British history and made headlines around the globe."
Morvern Callar,2002,7,Rated on 24 Jul 2016,1h 37min,Lynne Ramsay,"UK,Canada", Drama,"https://m.media-amazon.com/images/M/MV5BMTBjZmUxOTctYTM0Ni00ZjI0LTk5MDEtZWE2YzdlYzA5MzBmXkEyXkFqcGdeQXVyMTMxMTY0OTQ@._V1_UY268_CR3,0,182,268_AL_.jpg","After her beloved husband's suicide, a mourning supermarket worker and her best friend hit the road in Scotland, but find that grief is something that you can't run away from forever."
The Mirror,1975,7,Rated on 31 Jul 2016,1h 47min,Andrei Tarkovsky,Soviet Union," Biography, Drama","https://m.media-amazon.com/images/M/MV5BOGRiNDc0ZmMtZWVmNS00ZmRkLWEwNjQtODdmYTIyZGJjMjc5XkEyXkFqcGdeQXVyMTQxNzMzNDI@._V1_UY268_CR8,0,182,268_AL_.jpg","A dying man in his forties remembers his past. His childhood, his mother, the war, personal moments and things that tell of the recent history of all the Russian nation."
The Passion of Joan of Arc,1928,8,Rated on 06 Aug 2016,1h 54min,Carl Theodor Dreyer,France," Biography, Drama, History","https://m.media-amazon.com/images/M/MV5BNjBjNDJiYTUtOWY0OS00OGVmLTg2YzctMTE0NzVhODM1ZWJmXkEyXkFqcGdeQXVyNjU0OTQ0OTY@._V1_UX182_CR0,0,182,268_AL_.jpg","In 1431, Jeanne d'Arc is placed on trial on charges of heresy. The ecclesiastical jurists attempt to force Jeanne to recant her claims of holy visions."
The Naked Island,1960,8,Rated on 07 Aug 2016,1h 36min,Kaneto Shindô,Japan, Drama,"https://m.media-amazon.com/images/M/MV5BZGU4MjA0MjEtZWRjZS00MDYxLWIxODMtODQwMjk3OTMzZmY2XkEyXkFqcGdeQXVyMzIwNDY4NDI@._V1_UY268_CR7,0,182,268_AL_.jpg","A family of four are the sole inhabitants of a small island, where they struggle each day to irrigate their crops."
Grave of the Fireflies,1988,8,Rated on 12 Aug 2016,1h 29min,Isao Takahata,Japan," Animation, Drama, War","https://m.media-amazon.com/images/M/MV5BZmY2NjUzNDQtNTgxNC00M2Q4LTljOWQtMjNjNDBjNWUxNmJlXkEyXkFqcGdeQXVyNTA4NzY1MzY@._V1_UX182_CR0,0,182,268_AL_.jpg",A young boy and his little sister struggle to survive in Japan during World War II.
Jurassic Park,1993,7,Rated on 09 Aug 2016,2h 7min,Steven Spielberg,USA," Action, Adventure, Sci-Fi, Thriller","https://m.media-amazon.com/images/M/MV5BMjM2MDgxMDg0Nl5BMl5BanBnXkFtZTgwNTM2OTM5NDE@._V1_UX182_CR0,0,182,268_AL_.jpg",A pragmatic Paleontologist visiting an almost complete theme park is tasked with protecting a couple of kids after a power failure causes the park's cloned dinosaurs to run loose.
The Secret World of Arrietty,2010,6,Rated on 16 Aug 2016,1h 34min,Hiromasa Yonebayashi,Japan," Animation, Adventure, Family, Fantasy","https://m.media-amazon.com/images/M/MV5BNjY2OWYyNmEtNzYwMy00OGU4LWI4YzgtMWZjZDUwYWZlYjA3XkEyXkFqcGdeQXVyODU2MDg1NzU@._V1_UX182_CR0,0,182,268_AL_.jpg","The Clock family are four-inch-tall people who live anonymously in another family's residence, borrowing simple items to make their home. Life changes for the Clocks when their teenage daughter, Arrietty, is discovered."
The Wind Rises,2013,8,Rated on 09 Aug 2016,2h 6min,Hayao Miyazaki,Japan," Animation, Biography, Drama, History, Romance, War","https://m.media-amazon.com/images/M/MV5BZGZkNWQ1ZDQtMjYzNy00NmYxLWEwMDEtNjY2Y2U2ZWEyOGQ5L2ltYWdlXkEyXkFqcGdeQXVyNTAyODkwOQ@@._V1_UY268_CR4,0,182,268_AL_.jpg","A look at the life of Jiro Horikoshi, the man who designed Japanese fighter planes during World War II."
The 400 Blows,1959,8,Rated on 15 Aug 2016,1h 39min,François Truffaut,France," Crime, Drama","https://m.media-amazon.com/images/M/MV5BYTQ4MjA4NmYtYjRhNi00MTEwLTg0NjgtNjk3ODJlZGU4NjRkL2ltYWdlL2ltYWdlXkEyXkFqcGdeQXVyNjU0OTQ0OTY@._V1_UY268_CR10,0,182,268_AL_.jpg","A young boy, left without attention, delves into a life of petty crime."
Fata Morgana,1971,7,Rated on 22 Aug 2016,1h 19min,Werner Herzog,West Germany," Documentary, Comedy, Drama","https://m.media-amazon.com/images/M/MV5BYmNjMjI1YzUtNDlhNS00NmQ3LTg4OGEtZWYwMzdmMjJjMTJjXkEyXkFqcGdeQXVyMzIwNDY4NDI@._V1_UY268_CR2,0,182,268_AL_.jpg","Footage shot in and around the Sahara Desert, accompanied only by a spoken creation myth and the songs of"
Silicon Valley,,8,Rated on 05 Aug 2016,28min,"John Altschuler,Mike Judge,Dave Krinsky",USA, Comedy,"https://m.media-amazon.com/images/M/MV5BOTcwNzU2MGEtMzUzNC00MzMwLWJhZGItNDY3NDllYjU5YzAyXkEyXkFqcGdeQXVyMzQ2MDI5NjU@._V1_UX182_CR0,0,182,268_AL_.jpg","Follows the struggle of Richard Hendricks, a Silicon Valley engineer trying to build his own company called Pied Piper."
Repo Man,1984,7,Rated on 28 Aug 2016,1h 32min,Alex Cox,USA," Comedy, Crime, Sci-Fi, Thriller","https://m.media-amazon.com/images/M/MV5BNzdkMzVhNTgtMjlhNC00M2JkLWI3MzktYzdkNzYxNTk1NjcwXkEyXkFqcGdeQXVyMTQxNzMzNDI@._V1_UX182_CR0,0,182,268_AL_.jpg","Young punk Otto becomes a repo man after helping to steal a car, and stumbles into a world of wackiness as a result."
Sanjuro,1962,8,Rated on 28 Aug 2016,1h 36min,Akira Kurosawa,Japan," Action, Comedy, Crime, Drama, Thriller","https://m.media-amazon.com/images/M/MV5BZmY3MDlmODctYTY3Yi00NzYyLWIxNTUtYjVlZWZjMmMwZTBkXkEyXkFqcGdeQXVyMzAxNjg3MjQ@._V1_UX182_CR0,0,182,268_AL_.jpg","A crafty samurai helps a young man and his fellow clansmen save his uncle, who has been framed and imprisoned by a corrupt superintendent."
Oldboy,2003,8,Rated on 29 Aug 2016,2h,Chan-wook Park,South Korea," Action, Drama, Mystery, Thriller","https://m.media-amazon.com/images/M/MV5BZWFlZWI3MWQtODgzOS00MjVmLTg2ODMtOWE3NWFjOWZkMTY4XkEyXkFqcGdeQXVyMjQ1NjEyNzE@._V1_UY268_CR3,0,182,268_AL_.jpg","After being kidnapped and imprisoned for fifteen years, Oh Dae-Su is released, only to find that he must find his captor in five days."
Listen to Me Marlon,2015,7,Rated on 22 Aug 2016,1h 43min,Stevan Riley,UK," Documentary, Biography","https://m.media-amazon.com/images/M/MV5BMjEyNDQyMTc2NF5BMl5BanBnXkFtZTgwMjMzMTAwNjE@._V1_UX182_CR0,0,182,268_AL_.jpg",A documentary that utilizes hundreds of hours of audio that
Eastern Promises,2007,8,Rated on 29 Aug 2016,1h 40min,David Cronenberg,"UK,Canada,USA"," Action, Crime, Drama, Thriller","https://m.media-amazon.com/images/M/MV5BMTcwMzU0OTY3NF5BMl5BanBnXkFtZTYwNzkwNjg2._V1_UX182_CR0,0,182,268_AL_.jpg",A Russian teenager living in London who dies during childbirth leaves clues to a midwife in her journal that could tie her child to a rape involving a violent Russian mob family.
Fantastic Mr. Fox,2009,7,Rated on 30 Aug 2016,1h 27min,Wes Anderson,"USA,UK"," Animation, Adventure, Comedy, Crime, Drama, Family","https://m.media-amazon.com/images/M/MV5BOGUwYTU4NGEtNDM4MS00NDRjLTkwNmQtOTkwMWMyMjhmMjdlXkEyXkFqcGdeQXVyMTMxODk2OTU@._V1_UX182_CR0,0,182,268_AL_.jpg",An urbane fox cannot resist returning to his farm raiding ways and then must help his community survive the farmers' retaliation.
The Americans,,9,Rated on 17 Aug 2016,44min,Joseph Weisberg,USA," Crime, Drama, Mystery, Thriller","https://m.media-amazon.com/images/M/MV5BMjIzNTEzMDY3OF5BMl5BanBnXkFtZTcwMzI5NDI5OA@@._V1_UX182_CR0,0,182,268_AL_.jpg","At the height of the Cold War two Russian agents pose as your average American couple, complete with family."
Tangerine,2015,5,Rated on 04 Sep 2016,1h 28min,Sean Baker,USA," Comedy, Crime, Drama","https://m.media-amazon.com/images/M/MV5BMjEzNzY2NjYwOV5BMl5BanBnXkFtZTgwOTY1MDU1NTE@._V1_UX182_CR0,0,182,268_AL_.jpg",A hooker tears through Tinseltown on Christmas Eve searching for the pimp who broke her heart.
The Lady Vanishes,1938,7,Rated on 05 Sep 2016,1h 36min,Alfred Hitchcock,UK," Film-Noir, Mystery, Thriller","https://m.media-amazon.com/images/M/MV5BNjk3YzFjYTktOGY0ZS00Y2EwLTk2NTctYTI1Nzc2OWNiN2I4XkEyXkFqcGdeQXVyNzM0MTUwNTY@._V1_UX182_CR0,0,182,268_AL_.jpg","While travelling in continental Europe, a rich young playgirl realizes that an elderly lady seems to have disappeared from the train."
Beauty and the Beast,1946,8,Rated on 30 Aug 2016,1h 33min,"Jean Cocteau,René Clément",France," Drama, Fantasy, Romance","https://m.media-amazon.com/images/M/MV5BODMwNmZjZmEtZGE5MS00NGIyLTlhNzQtMDNkNzk4ODkxZmI2XkEyXkFqcGdeQXVyNTAyODkwOQ@@._V1_UY268_CR7,0,182,268_AL_.jpg","A beautiful young woman takes her father's place as the prisoner of a mysterious beast, who wishes to marry her."
Journey to Italy,1954,7,Rated on 01 Sep 2016,1h 37min,Roberto Rossellini,"Italy,France"," Drama, Romance","https://m.media-amazon.com/images/M/MV5BNTRiM2E4MGUtOGVkOS00OTIwLTg4MzEtMDEzOThiNTQ2YjY4XkEyXkFqcGdeQXVyNjI5NTk0MzE@._V1_UY268_CR5,0,182,268_AL_.jpg",An unhappily married couple attempts to find direction and insight while vacationing in Naples.
The Red Shoes,1948,8,Rated on 05 Sep 2016,2h 15min,"Michael Powell,Emeric Pressburger",UK," Drama, Music, Romance","https://m.media-amazon.com/images/M/MV5BOWRmNGEwZjUtZjEwNS00OGZmLThhMmEtZTJlMTU5MGQ3ZWUwXkEyXkFqcGdeQXVyNjc1NTYyMjg@._V1_UX182_CR0,0,182,268_AL_.jpg",A young ballet dancer is torn between the man she loves and her pursuit to become a prima ballerina.
Black Narcissus,1947,8,Rated on 10 Sep 2016,1h 41min,"Michael Powell,Emeric Pressburger",UK, Drama,"https://m.media-amazon.com/images/M/MV5BMTg3MDQxMzg2OF5BMl5BanBnXkFtZTgwNDY5NTY3MzE@._V1_UX182_CR0,0,182,268_AL_.jpg","After opening a convent in the Himalayas, five nuns encounter conflict and tension - both with the natives and also within their own group - as they attempt to adapt to their remote, exotic surroundings."
The Draughtsman's Contract,1982,8,Rated on 11 Sep 2016,1h 48min,Peter Greenaway,UK," Comedy, Drama, History, Mystery","https://m.media-amazon.com/images/M/MV5BMDJjMGM4N2UtMDE5Ny00NWNlLWI0NTgtMDA5ODNlNDVmN2U1L2ltYWdlXkEyXkFqcGdeQXVyNzc5MjA3OA@@._V1_UX182_CR0,0,182,268_AL_.jpg",A young artist is commissioned by the wife of a wealthy landowner to make a series of drawings of the estate while her husband is away.
Taste of Cherry,1997,7,Rated on 12 Sep 2016,1h 35min,Abbas Kiarostami,"Iran,France", Drama,"https://m.media-amazon.com/images/M/MV5BZjcxYmE5ZGUtMzQ5Ni00ODAxLWEyYzYtMTg3OTg4ZmU2NTM3XkEyXkFqcGdeQXVyNjMwMjk0MTQ@._V1_UX182_CR0,0,182,268_AL_.jpg",An Iranian man drives his truck in search of someone who will quietly bury him under a cherry tree after he commits suicide.
Of Time and the City,2008,7,Rated on 18 Sep 2016,1h 14min,Terence Davies,UK," Documentary, Biography","https://m.media-amazon.com/images/M/MV5BNDUxMzk4MDk4N15BMl5BanBnXkFtZTcwNTQ1NTQwMg@@._V1_UX182_CR0,0,182,268_AL_.jpg","A filmmaker looks at the history and transformation of his birthplace, Liverpool, England."
All the President's Men,1976,8,Rated on 25 Sep 2016,2h 18min,Alan J. Pakula,USA," Biography, Drama, History, Thriller","https://m.media-amazon.com/images/M/MV5BOWI2YWQxM2MtY2U4Yi00YjgzLTgwNzktN2ExNTgzNTIzMmUzXkEyXkFqcGdeQXVyMTAwMzUyOTc@._V1_UX182_CR0,0,182,268_AL_.jpg","""The Washington Post"" reporters"
Woman in the Dunes,1964,9,Rated on 18 Sep 2016,2h 3min,Hiroshi Teshigahara,Japan," Drama, Thriller","https://m.media-amazon.com/images/M/MV5BN2RlNTlkYTAtZDY2My00OGI0LWE1OTEtNmY1NDU2YTU0MGUxXkEyXkFqcGdeQXVyNjc1NTYyMjg@._V1_UY268_CR4,0,182,268_AL_.jpg",An entomologist on vacation is trapped by local villagers into living with a woman whose life task is shoveling sand for them.
Hell or High Water,2016,8,Rated on 12 Sep 2016,1h 42min,David Mackenzie,USA," Action, Crime, Drama, Thriller, Western","https://m.media-amazon.com/images/M/MV5BMTg4NDA1OTA5NF5BMl5BanBnXkFtZTgwMDQ2MDM5ODE@._V1_UX182_CR0,0,182,268_AL_.jpg",A divorced father and his ex-con older brother resort to a desperate scheme in order to save their family's ranch in West Texas.
The Diving Bell and the Butterfly,2007,8,Rated on 26 Sep 2016,1h 52min,Julian Schnabel,"France,USA"," Biography, Drama","https://m.media-amazon.com/images/M/MV5BMTc3MjkzMDkxN15BMl5BanBnXkFtZTcwODAyMTU1MQ@@._V1_UY268_CR0,0,182,268_AL_.jpg",The true story of Elle editor
