title,year,rating,date_rated,duration,director,country,genre,image,summary
Pierrot le Fou,1965,6,Rated on 16 Apr 2018,1h 50min,Jean-Luc Godard,"France,Italy"," Crime, Drama, Romance","https://m.media-amazon.com/images/M/MV5BMTQ0OTc4MDcxMl5BMl5BanBnXkFtZTgwNjIzMjA0NzE@._V1_UY268_CR8,0,182,268_AL_.jpg","Pierrot escapes his boring society and travels from Paris to the Mediterranean Sea with Marianne, a girl chased by hit-men from Algeria. They lead an unorthodox life, always on the run."
The Edge of the World,1937,7,Rated on 14 Apr 2018,1h 14min,Michael Powell,UK," Drama, History, Romance","https://m.media-amazon.com/images/M/MV5BMTU1MDc4MzI2OF5BMl5BanBnXkFtZTYwNjgxNTg5._V1_UY268_CR1,0,182,268_AL_.jpg","A way of life is dying on an Outer Hebridean island fishing port, but some of the inhabitants resist evacuating to the mainland."
The Son,2002,9,Rated on 16 Apr 2018,1h 39min,"Jean-Pierre Dardenne,Luc Dardenne","Belgium,France"," Drama, Mystery","https://m.media-amazon.com/images/M/MV5BMTI3NzkzOTQ0NF5BMl5BanBnXkFtZTcwNDg2MjUyMQ@@._V1_UY268_CR3,0,182,268_AL_.jpg","A joinery instructor at a rehab center refuses to take a new teen as his apprentice, but then begins to follow the boy through the hallways and streets."
Nights of Cabiria,1957,8,Rated on 22 Apr 2018,1h 50min,Federico Fellini,"Italy,France", Drama,"https://m.media-amazon.com/images/M/MV5BZjllMDcyY2YtZDc5Zi00NDRlLThkZmItMTJhOWZmYjM0NmQyXkEyXkFqcGdeQXVyNTc1NDM0NDU@._V1_UY268_CR2,0,182,268_AL_.jpg",A waifish prostitute wanders the streets of Rome looking for true love but finds only heartbreak.
Pickpocket,1959,8,Rated on 29 Apr 2018,1h 16min,Robert Bresson,France," Crime, Drama","https://m.media-amazon.com/images/M/MV5BZWNlMTM4YTYtNWY4NS00MDQzLTkzOWQtYzU0MGUxOTM3NzI3XkEyXkFqcGdeQXVyNjc1NTYyMjg@._V1_UY268_CR4,0,182,268_AL_.jpg",Michel is released from jail after serving a sentence for thievery. His mother dies and he resorts to pickpocketing as a means of survival.
Bring Me the Head of Alfredo Garcia,1974,8,Rated on 30 Apr 2018,1h 52min,Sam Peckinpah,"Mexico,USA"," Action, Crime, Drama, Thriller, Western","https://m.media-amazon.com/images/M/MV5BYmY2ZmUzMDMtZmZlYy00YmU5LWFiYjUtZmExNzRkODdkYWQyXkEyXkFqcGdeQXVyMjI4MjA5MzA@._V1_UX182_CR0,0,182,268_AL_.jpg",An American bar room pianist and his prostitute girlfriend go on a trip through the Mexican underworld to collect a bounty on the head of a dead gigolo.
The Apartment,1960,8,Rated on 23 Apr 2018,2h 5min,Billy Wilder,USA," Comedy, Drama, Romance","https://m.media-amazon.com/images/M/MV5BNzkwODFjNzItMmMwNi00MTU5LWE2MzktM2M4ZDczZGM1MmViXkEyXkFqcGdeQXVyNDY2MTk1ODk@._V1_UX182_CR0,0,182,268_AL_.jpg","A man tries to rise in his company by letting its executives use his apartment for trysts, but complications and a romance of his own ensue."
My Darling Clementine,1946,7,Rated on 05 May 2018,1h 37min,John Ford,USA," Biography, Drama, Western","https://m.media-amazon.com/images/M/MV5BZTQ5MTc1NzYtZmIyYi00YzdjLTk4OWEtMDQyNmU1MTQ2MzkzXkEyXkFqcGdeQXVyNjc1NTYyMjg@._V1_UX182_CR0,0,182,268_AL_.jpg","The Earps battle the Clantons at the OK Corral in Tombstone, Arizona."
That Obscure Object of Desire,1977,8,Rated on 13 May 2018,1h 43min,Luis Buñuel,"France,Spain"," Comedy, Drama","https://m.media-amazon.com/images/M/MV5BNzY5NDZjNTEtMTVlZC00MzkxLTllNjQtZmQ5ODE3ZWQxNGM4XkEyXkFqcGdeQXVyMTMxMTY0OTQ@._V1_UY268_CR9,0,182,268_AL_.jpg","Recounted in flashback are the romantic perils of Mathieu, a middle-aged French sophisticate as he falls for his nineteen year-old former chambermaid Conchita."
Once Upon a Time in America,1984,8,Rated on 09 May 2018,3h 49min,Sergio Leone,"USA,Italy"," Crime, Drama","https://m.media-amazon.com/images/M/MV5BMGFkNWI4MTMtNGQ0OC00MWVmLTk3MTktOGYxN2Y2YWVkZWE2XkEyXkFqcGdeQXVyNjU0OTQ0OTY@._V1_UX182_CR0,0,182,268_AL_.jpg","A former Prohibition-era Jewish gangster returns to the Lower East Side of Manhattan over thirty years later, where he once again must confront the ghosts and regrets of his old life."
L.A. Confidential,1997,7,Rated on 08 May 2018,2h 18min,Curtis Hanson,USA," Crime, Drama, Mystery, Thriller","https://m.media-amazon.com/images/M/MV5BMDQ2YzEyZGItYWRhOS00MjBmLTkzMDUtMTdjYzkyMmQxZTJlXkEyXkFqcGdeQXVyNjU0OTQ0OTY@._V1_UY268_CR0,0,182,268_AL_.jpg","As corruption grows in 1950s Los Angeles, three policemen -- one strait-laced, one brutal, and one sleazy -- investigate a series of murders with their own brand of justice."
Key Largo,1948,7,Rated on 18 May 2018,1h 40min,John Huston,USA," Action, Crime, Drama, Film-Noir, Thriller","https://m.media-amazon.com/images/M/MV5BNGYzMGNkNGMtNjY3ZC00MGQ4LTlkZjgtOWY4ZDU0OWIzMDgzXkEyXkFqcGdeQXVyNTAyODkwOQ@@._V1_UY268_CR2,0,182,268_AL_.jpg","A man visits his war buddy's family hotel and finds a gangster running things. As a hurricane approaches, the two end up confronting each other."
Closely Watched Trains,1966,8,Rated on 20 May 2018,1h 32min,Jirí Menzel,Czechoslovakia," Comedy, Drama, Romance, War","https://m.media-amazon.com/images/M/MV5BZmQ5MDdlMjktYzVmNy00YzNmLWFiY2QtYzI3ZDE2ZDZiNjAxXkEyXkFqcGdeQXVyNzc5MjA3OA@@._V1_UX182_CR0,0,182,268_AL_.jpg",An apprentice train dispatcher at a village station seeks his first sexual encounter and becomes despondent when he is unable to perform.
Diabolique,1955,7,Rated on 22 May 2018,1h 57min,Henri-Georges Clouzot,France," Crime, Drama, Horror, Mystery, Thriller","https://m.media-amazon.com/images/M/MV5BMGJmNmU5OTAtOTQyYy00MmM3LTk4MzUtMGFiZDYzODdmMmU4XkEyXkFqcGdeQXVyNjU0OTQ0OTY@._V1_UY268_CR9,0,182,268_AL_.jpg",The wife and mistress of a loathed school principal hatch a plan to murder him while having the perfect alibi. They carry out the plan...but then his body disappears.
The Seventh Seal,1957,8,Rated on 20 May 2018,1h 36min,Ingmar Bergman,Sweden," Drama, Fantasy","https://m.media-amazon.com/images/M/MV5BM2I1ZWU4YjMtYzU0My00YmMzLWFmNTAtZDJhZGYwMmI3YWQ5XkEyXkFqcGdeQXVyNjU0OTQ0OTY@._V1_UX182_CR0,0,182,268_AL_.jpg","A man seeks answers about life, death, and the existence of God as he plays chess against the Grim Reaper during the Black Plague."
The Gold Rush,1925,7,Rated on 19 May 2018,1h 35min,Charles Chaplin,USA," Adventure, Comedy, Drama, Family","https://m.media-amazon.com/images/M/MV5BZjEyOTE4MzMtNmMzMy00Mzc3LWJlOTQtOGJiNDE0ZmJiOTU4L2ltYWdlXkEyXkFqcGdeQXVyNTAyODkwOQ@@._V1_UY268_CR7,0,182,268_AL_.jpg",A prospector goes to the Klondike in search of gold and finds it and more.
The Getaway,1972,7,Rated on 23 May 2018,2h 3min,Sam Peckinpah,USA," Action, Crime, Thriller","https://m.media-amazon.com/images/M/MV5BZWU1NDNmZTAtNDlhYy00MmY0LTlhMWUtZGNiNzA2ODA5MDY1XkEyXkFqcGdeQXVyMjI4MjA5MzA@._V1_UX182_CR0,0,182,268_AL_.jpg",A recently released ex-con and his loyal wife go on the run after a heist goes awry.
La Ronde,1950,8,Rated on 22 May 2018,1h 33min,Max Ophüls,France," Drama, Romance","https://m.media-amazon.com/images/M/MV5BMTY1ODg1MzAyN15BMl5BanBnXkFtZTgwMDkzMjE1MjE@._V1_UY268_CR4,0,182,268_AL_.jpg",Vignettes revolving around a circle of interconnected love.
The Kid with a Bike,2011,8,Rated on 21 May 2018,1h 27min,"Jean-Pierre Dardenne,Luc Dardenne","Belgium,France,Italy", Drama,"https://m.media-amazon.com/images/M/MV5BMTQ3OTE3MzAyMl5BMl5BanBnXkFtZTcwNDU1OTIzNw@@._V1_UY268_CR1,0,182,268_AL_.jpg","Abandoned by his father, a young boy is left in a state-run youth farm. In a random act of kindness, the town hair-dresser agrees to foster him on week-ends."
Mildred Pierce,1945,7,Rated on 21 May 2018,1h 51min,Michael Curtiz,USA," Crime, Drama, Film-Noir, Mystery, Romance","https://m.media-amazon.com/images/M/MV5BNzljY2U2MDItYWE3Yi00OWE3LWEyMjQtMGNkZmJjNDE0NDJjXkEyXkFqcGdeQXVyNjc1NTYyMjg@._V1_UX182_CR0,0,182,268_AL_.jpg",A hard-working mother inches towards disaster as she divorces her husband and starts a successful restaurant business to support her spoiled daughter.
Best in Show,2000,7,Rated on 23 May 2018,1h 30min,Christopher Guest,USA, Comedy,"https://m.media-amazon.com/images/M/MV5BMTQ5OTc0NDU1MF5BMl5BanBnXkFtZTYwNzk1OTI3._V1_UX182_CR0,0,182,268_AL_.jpg",A colorful array of characters compete at a national dog show.
Walkabout,1971,7,Rated on 23 May 2018,1h 40min,Nicolas Roeg,"UK,Australia"," Adventure, Drama","https://m.media-amazon.com/images/M/MV5BMzI1ZjA3ZDAtYmQ4My00MzZhLWJmYjMtMzc5M2FlMDk2YzExXkEyXkFqcGdeQXVyNjc1NTYyMjg@._V1_UX182_CR0,0,182,268_AL_.jpg","Two city-bred siblings are stranded in the Australian Outback, where they learn to survive with the aid of an Aboriginal boy on his ""walkabout"": a ritual separation from his tribe."
Magnolia,1999,9,Rated on 24 May 2018,3h 8min,Paul Thomas Anderson,USA, Drama,"https://m.media-amazon.com/images/M/MV5BZjk3YThkNDktNjZjMS00MTBiLTllNTAtYzkzMTU0N2QwYjJjXkEyXkFqcGdeQXVyMTMxODk2OTU@._V1_UX182_CR0,0,182,268_AL_.jpg","An epic mosaic of interrelated characters in search of love, forgiveness, and meaning in the San Fernando Valley."
Band of Outsiders,1964,7,Rated on 25 May 2018,1h 35min,Jean-Luc Godard,France," Comedy, Crime, Drama","https://m.media-amazon.com/images/M/MV5BMjIyOTA0Njk3Ml5BMl5BanBnXkFtZTgwMzY0NTA2ODE@._V1_UY268_CR4,0,182,268_AL_.jpg",Two crooks with a fondness for old Hollywood B-movies convince a languages student to help them commit a robbery.
Amarcord,1973,7,Rated on 26 May 2018,2h 3min,Federico Fellini,"Italy,France"," Comedy, Drama","https://m.media-amazon.com/images/M/MV5BZDI2OTg2NDQtMzc0MC00MjRiLWI1NzAtMjY2ZDMwMmUyNzBiXkEyXkFqcGdeQXVyNzM0MTUwNTY@._V1_UX182_CR0,0,182,268_AL_.jpg",A series of comedic and nostalgic vignettes set in a 1930s Italian coastal town.
The Earrings of Madame De...,1953,8,Rated on 25 May 2018,1h 45min,Max Ophüls,"France,Italy"," Drama, Romance","https://m.media-amazon.com/images/M/MV5BYzAyMjA2YzgtNTMzZS00MjU5LThhYTUtMzdjNWNiMmExYzQ3XkEyXkFqcGdeQXVyMzg1ODEwNQ@@._V1_UY268_CR2,0,182,268_AL_.jpg","The diamond earrings of a French aristocrat, a wedding gift from her husband, cause a series of conflicts as they change hands repeatedly."
Werckmeister Harmonies,2000,7,Rated on 27 May 2018,2h 25min,"Béla Tarr,Ágnes Hranitzky","Hungary,Italy,Germany,France"," Drama, Mystery","https://m.media-amazon.com/images/M/MV5BMDE3ODViYjYtMTIyMy00ZTBjLWIxZGUtZjljODlmODRkMTkxXkEyXkFqcGdeQXVyMTA1NTM1NDI2._V1_UY268_CR4,0,182,268_AL_.jpg","An innocent young man witnesses violence break out after an isolated village is inflamed by the arrival of a circus and its peculiar attractions: a giant whale and a mysterious man named ""The Prince."""
The Music Room,1958,8,Rated on 24 May 2018,1h 35min,Satyajit Ray,India," Drama, Music","https://m.media-amazon.com/images/M/MV5BNmVhOWViMGQtMDBmNS00YmM3LTlmOGItMjRmN2VjNWExNWIzXkEyXkFqcGdeQXVyNzM0MTUwNTY@._V1_UX182_CR0,0,182,268_AL_.jpg","Depicts the end days of a decadent zamindar (landlord) in Bengal, and his efforts to uphold his family prestige even when faced with economic adversity."
The Bird with the Crystal Plumage,1970,7,Rated on 26 May 2018,1h 36min,Dario Argento,"Italy,West Germany"," Horror, Mystery, Thriller","https://m.media-amazon.com/images/M/MV5BYjFiNzRkNjItYmVhMi00MzQ2LWJhOTAtYTljMGRhZjU2NTM3XkEyXkFqcGdeQXVyMTQxNzMzNDI@._V1_UX182_CR0,0,182,268_AL_.jpg","An American expatriate in Rome witnesses an attempted murder. He learns later that it's connected to an ongoing murder spree in the city, and decides to do his own investigation, despite being personally targeted by the killer."
Kiss Kiss Bang Bang,2005,6,Rated on 29 May 2018,1h 43min,Shane Black,USA," Action, Comedy, Crime, Mystery, Thriller","https://m.media-amazon.com/images/M/MV5BMTY5NDExMDA3M15BMl5BanBnXkFtZTYwNTc2MzA3._V1_UX182_CR0,0,182,268_AL_.jpg","A murder mystery brings together a private eye, a struggling actress, and a thief masquerading as an actor."
An Autumn Afternoon,1962,8,Rated on 30 May 2018,1h 53min,Yasujirô Ozu,Japan, Drama,"https://m.media-amazon.com/images/M/MV5BOWIxY2JkYTgtNjkxYS00NGFmLTgxMGEtOTYxMjBkNWQ2YzgwXkEyXkFqcGdeQXVyNjc1NTYyMjg@._V1_UY268_CR4,0,182,268_AL_.jpg",An aging widower arranges a marriage for his only daughter.
The Freshman,1925,7,Rated on 27 May 2018,1h 17min,"Fred C. Newmeyer,Sam Taylor",USA," Comedy, Family, Romance, Sport","https://m.media-amazon.com/images/M/MV5BMGJmNTE4MGYtZWY2My00YmUzLWFiOWUtY2VkNmEzZGQ1ZGViXkEyXkFqcGdeQXVyMDI2NDg0NQ@@._V1_UX182_CR0,0,182,268_AL_.jpg",A nerdy college student will do anything to become popular on campus.
Drifting Clouds,1996,8,Rated on 25 May 2018,1h 37min,Aki Kaurismäki,"Finland,Germany,France"," Comedy, Drama","https://m.media-amazon.com/images/M/MV5BMTMxZjFiYmMtMGFiYi00ZTUxLWE3MGItNjE3ZGRhMmE4NWNkXkEyXkFqcGdeQXVyMjI0MjMwMzQ@._V1_UY268_CR3,0,182,268_AL_.jpg",The recession hits a couple in Helsinki.
Certified Copy,2010,8,Rated on 28 May 2018,1h 46min,Abbas Kiarostami,"France,Italy,Belgium,Iran"," Drama, Romance","https://m.media-amazon.com/images/M/MV5BMjAyODExNjExNV5BMl5BanBnXkFtZTcwMjMxNTI1NA@@._V1_UX182_CR0,0,182,268_AL_.jpg","In Tuscany to promote his latest book, a middle-aged British writer meets a French woman who leads him to the village of Lucignano. While there, a chance question reveals something deeper."
Shadow of a Doubt,1943,7,Rated on 03 Jun 2018,1h 48min,Alfred Hitchcock,USA, Thriller,"https://m.media-amazon.com/images/M/MV5BYzUyOGE2Y2EtYzI2My00MDcxLWFmNzYtYjMzN2NiMmMzMzAzL2ltYWdlL2ltYWdlXkEyXkFqcGdeQXVyNjc1NTYyMjg@._V1_UX182_CR0,0,182,268_AL_.jpg",A young woman discovers her visiting uncle may not be the man he seems to be.
The Bitter Tears of Petra von Kant,1972,8,Rated on 04 Jun 2018,2h 4min,Rainer Werner Fassbinder,West Germany," Drama, Romance","https://m.media-amazon.com/images/M/MV5BYzZlMmQ1NWEtZGJiNC00MjgzLWIyMmUtZGE0YWQyOTBhNmQ5XkEyXkFqcGdeQXVyMTMxMTY0OTQ@._V1_UY268_CR15,0,182,268_AL_.jpg",An arrogant fashion designer falls in love with an icy beauty who wants to be a model.
Chinese Roulette,1976,7,Rated on 09 Jun 2018,1h 26min,Rainer Werner Fassbinder,"West Germany,France"," Drama, Thriller","https://m.media-amazon.com/images/M/MV5BM2NhNzNkMGEtMjdhNy00OWE4LTk2MDMtOGU5NzdmOGFhZjUxXkEyXkFqcGdeQXVyMzIwNDY4NDI@._V1_UY268_CR5,0,182,268_AL_.jpg","Both the parents of a young teen who walks with crutches, goes on each their secret meeting with lovers, both surprising each other at the family's county home. The daughter arrives and initiates a guessing game of ""Chinese roulette""."
Pat Garrett & Billy the Kid,1973,7,Rated on 03 Jun 2018,2h 2min,Sam Peckinpah,"USA,Mexico"," Biography, Drama, Western","https://m.media-amazon.com/images/M/MV5BNDU3NDA3YWEtM2ZlMi00NWNiLTliYWQtMmVmM2UwY2VlY2M5XkEyXkFqcGdeQXVyNzM0MTUwNTY@._V1_UY268_CR3,0,182,268_AL_.jpg",Pat Garrett is hired as a lawman on behalf of a group of wealthy New Mexico cattle barons to bring down his old friend Billy the Kid.
Songs from the Second Floor,2000,6,Rated on 02 Jun 2018,1h 38min,Roy Andersson,"Sweden,Norway,Denmark"," Comedy, Drama","https://m.media-amazon.com/images/M/MV5BMGQ4NGQ3MjAtYWI4Mi00YTQ1LTg1NWItN2RhYWU5YmY0Yjg0XkEyXkFqcGdeQXVyNzQxNDExNTU@._V1_UY268_CR1,0,182,268_AL_.jpg","Where are we humans going? A film poem inspired by the Peruvian poet César Vallejo. We meet people in the city. People trying to communicate, searching compassion and get the connection of small and large things."
The Sting,1973,7,Rated on 10 Jun 2018,2h 9min,George Roy Hill,USA," Comedy, Crime, Drama","https://m.media-amazon.com/images/M/MV5BNGU3NjQ4YTMtZGJjOS00YTQ3LThmNmItMTI5MDE2ODI3NzY3XkEyXkFqcGdeQXVyMjUzOTY1NTc@._V1_UX182_CR0,0,182,268_AL_.jpg",Two grifters team up to pull off the ultimate con.
Don't Look Now,1973,7,Rated on 10 Jun 2018,1h 50min,Nicolas Roeg,"UK,Italy"," Drama, Horror, Thriller","https://m.media-amazon.com/images/M/MV5BNDZmYzJmMDQtM2NkNi00NjU0LTlmZGItNDFjZjVkZjhmNDcyXkEyXkFqcGdeQXVyMTA1NTM1NDI2._V1_UX182_CR0,0,182,268_AL_.jpg","A married couple grieving the recent death of their young daughter are in Venice when they encounter two elderly sisters, one of whom is psychic and brings a warning from beyond."
Waiting for Guffman,1996,8,Rated on 30 May 2018,1h 24min,Christopher Guest,USA, Comedy,"https://m.media-amazon.com/images/M/MV5BYWY4OGVjOTctYTViZC00MWQzLWIyNjYtM2JmOWIzZGQwNWYyXkEyXkFqcGdeQXVyMTQxNzMzNDI@._V1_UX182_CR0,0,182,268_AL_.jpg",An aspiring director and the marginally talented amateur cast of a hokey small-town Missouri musical production go overboard when they learn that someone from Broadway will be in attendance.
Hard Eight,1996,7,Rated on 11 Jun 2018,1h 41min,Paul Thomas Anderson,USA," Crime, Drama","https://m.media-amazon.com/images/M/MV5BY2E0Mjc3MWEtNjYxNC00Y2UwLThmNTQtYmUyMTIzMzE2MTMwXkEyXkFqcGdeQXVyMTQxNzMzNDI@._V1_UX182_CR0,0,182,268_AL_.jpg",Professional gambler Sydney teaches John the tricks of the trade. John does well until he falls for cocktail waitress Clementine.
Cinema Paradiso,1988,7,Rated on 28 Jun 2018,2h 35min,Giuseppe Tornatore,"Italy,France", Drama,"https://m.media-amazon.com/images/M/MV5BM2FhYjEyYmYtMDI1Yy00YTdlLWI2NWQtYmEzNzAxOGY1NjY2XkEyXkFqcGdeQXVyNTA3NTIyNDg@._V1_UX182_CR0,0,182,268_AL_.jpg",A filmmaker recalls his childhood when falling in love with the pictures at the cinema of his home village and forms a deep friendship with the cinema's projectionist.
Last Tango in Paris,1972,7,Rated on 11 Jun 2018,2h 9min,Bernardo Bertolucci,"France,Italy"," Drama, Romance","https://m.media-amazon.com/images/M/MV5BMGZkMTlhYjMtNTg2YS00M2NlLTgwNjQtZDZjMzk5ODY4NmYxXkEyXkFqcGdeQXVyMTYzMDM0NTU@._V1_UY268_CR5,0,182,268_AL_.jpg",A young Parisian woman meets a middle-aged American businessman who demands their clandestine relationship be based only on sex.
The River,1951,7,Rated on 16 Jun 2018,1h 39min,Jean Renoir,"France,UK,India,USA"," Drama, Romance","https://m.media-amazon.com/images/M/MV5BMzZiYzYwMTktMDkwMi00M2YyLTk1ODQtZjI3YzE2NjdkYTZlXkEyXkFqcGdeQXVyNTEwNDcxNDc@._V1_UX182_CR0,0,182,268_AL_.jpg","Three adolescent girls growing up in Bengal, India, learn their lessons in life after falling for an older American soldier."
American Graffiti,1973,7,Rated on 30 Jun 2018,1h 50min,George Lucas,USA," Comedy, Drama","https://m.media-amazon.com/images/M/MV5BMjI5NjM5MjIyNF5BMl5BanBnXkFtZTgwNjg2MTUxMDE@._V1_UX182_CR0,0,182,268_AL_.jpg",A couple of high school grads spend one final night cruising the strip with their buddies before they go off to college.
Deep End,1970,7,Rated on 25 Jun 2018,1h 28min,Jerzy Skolimowski,"UK,West Germany"," Comedy, Drama, Romance","https://m.media-amazon.com/images/M/MV5BMmU1Y2QwYjUtZWYwZC00MGQyLWE4OWUtYWMwMGQ2NzUxNjkxXkEyXkFqcGdeQXVyMjUzOTY1NTc@._V1_UX182_CR0,0,182,268_AL_.jpg","15-year-old dropout Mike takes a job at Newford Baths, where inappropriate sexual behaviour abounds, and becomes obsessed with his coworker Susan."
The Man Who Shot Liberty Valance,1962,8,Rated on 25 Jun 2018,2h 3min,John Ford,USA," Drama, Western","https://m.media-amazon.com/images/M/MV5BMGEyNzhkYzktMGMyZS00YzRiLWJlYjktZjJkOTU5ZDY0ZGI4XkEyXkFqcGdeQXVyNjUwNzk3NDc@._V1_UX182_CR0,0,182,268_AL_.jpg","A senator, who became famous for killing a notorious outlaw, returns for the funeral of an old friend and tells the truth about his deed."
The Ballad of Cable Hogue,1970,7,Rated on 29 Jun 2018,2h 1min,Sam Peckinpah,USA," Comedy, Drama, Romance, Western","https://m.media-amazon.com/images/M/MV5BMTQwMjkwNjE0Ml5BMl5BanBnXkFtZTgwOTU5ODIyMTE@._V1_UX182_CR0,0,182,268_AL_.jpg","A hobo accidentally stumbles onto a water spring, and creates a profitable way station in the middle of the desert."
The Woman Next Door,1981,7,Rated on 30 Jun 2018,1h 46min,François Truffaut,France," Drama, Romance","https://m.media-amazon.com/images/M/MV5BMTY5MDkwODA4N15BMl5BanBnXkFtZTcwMzE2NDQ4Ng@@._V1_UY268_CR10,0,182,268_AL_.jpg",Two ex-lovers wind up living next door to each other with their respective spouses. Forbidden passions ensue.
Code Unknown,2000,8,Rated on 29 Jun 2018,1h 58min,Michael Haneke,"France,Austria,Romania,Germany", Drama,"https://m.media-amazon.com/images/M/MV5BZWM1YzdkNjYtNTI4NS00ZTU1LTgxMzYtNDAzOGU2N2FhZDdlXkEyXkFqcGdeQXVyMjYyNzc4MQ@@._V1_UY268_CR8,0,182,268_AL_.jpg","A young man harasses a homeless woman, another man protests, the police arrest both and the woman has to leave the country. What were their various story-lines leading up to this event?"
Johnny Guitar,1954,7,Rated on 01 Jul 2018,1h 50min,Nicholas Ray,USA," Drama, Western","https://m.media-amazon.com/images/M/MV5BZDYxMTQzNjgtZDJkMC00OGYwLTliYjgtNDA2ZjBiMmUxYmY4XkEyXkFqcGdeQXVyNjc1NTYyMjg@._V1_UX182_CR0,0,182,268_AL_.jpg","After helping a wounded gang member, a strong-willed female saloon owner is wrongly suspected of murder and bank robbery by a lynch mob."
The Turin Horse,2011,7,Rated on 01 Jul 2018,2h 35min,"Béla Tarr,Ágnes Hranitzky","Hungary,France,Switzerland,Germany,USA", Drama,"https://m.media-amazon.com/images/M/MV5BMTMyNzg1MzM2Ml5BMl5BanBnXkFtZTcwMzQ5NjcxNw@@._V1_UX182_CR0,0,182,268_AL_.jpg",A rural farmer is forced to confront the mortality of his faithful horse.
The White Ribbon,2009,8,Rated on 02 Jul 2018,2h 24min,Michael Haneke,"Germany,Austria,France,Italy,Canada"," Drama, History, Mystery, Thriller","https://m.media-amazon.com/images/M/MV5BMTQ2OTYyNzUxOF5BMl5BanBnXkFtZTcwMzUwMDY4Mg@@._V1_UX182_CR0,0,182,268_AL_.jpg","Strange events happen in a small village in the north of Germany during the years before World War I, which seem to be ritual punishment. Who is responsible?"
Enemy,2013,7,Rated on 08 Jul 2018,1h 31min,Denis Villeneuve,"Canada,Spain,France"," Mystery, Thriller","https://m.media-amazon.com/images/M/MV5BMTQ2NzA5NjE4N15BMl5BanBnXkFtZTgwMjQ4NzMxMTE@._V1_UX182_CR0,0,182,268_AL_.jpg",A man seeks out his exact look-alike after spotting him in a movie.
Life Is Sweet,1990,8,Rated on 08 Jul 2018,1h 43min,Mike Leigh,UK," Comedy, Drama","https://m.media-amazon.com/images/M/MV5BNjM4NTk5OTMtN2EzOS00N2U3LTlhYjgtZjAwMjkyYzQ0ZTg0XkEyXkFqcGdeQXVyMTAwMzUyOTc@._V1_UY268_CR0,0,182,268_AL_.jpg","A shop assistant, her cook husband, & their twin daughters ponder their lives over a few weeks in a working-class suburb north of London."
Hiroshima Mon Amour,1959,7,Rated on 12 Aug 2018,1h 30min,Alain Resnais,"France,Japan"," Drama, Romance","https://m.media-amazon.com/images/M/MV5BMzY2NTA1MzUwN15BMl5BanBnXkFtZTgwOTc4NTU4MjE@._V1_UX182_CR0,0,182,268_AL_.jpg",A French actress filming an anti-war film in Hiroshima has an affair with a married Japanese architect as they share their differing perspectives on war.
Prince of Darkness,1987,7,Rated on 08 Jul 2018,1h 42min,John Carpenter,USA, Horror,"https://m.media-amazon.com/images/M/MV5BZmI1ODg4MjYtY2U4NS00NTRlLWJlMDEtYjY2YzJkNWVhMDdiXkEyXkFqcGdeQXVyMTQxNzMzNDI@._V1_UX182_CR0,0,182,268_AL_.jpg","A research team finds a mysterious cylinder in a deserted church. If opened, it could mean the end of the world."
Cries & Whispers,1972,8,Rated on 17 Jul 2018,1h 31min,Ingmar Bergman,Sweden, Drama,"https://m.media-amazon.com/images/M/MV5BMTg3NzYzOTEtNmE2Ni00M2EyLWJhMjctNjMyMTk4ZTViOGUzXkEyXkFqcGdeQXVyNzQxNDExNTU@._V1_UY268_CR2,0,182,268_AL_.jpg","When a woman dying of cancer in early twentieth-century Sweden is visited by her two sisters, long-repressed feelings between the siblings rise to the surface."
Mishima: A Life in Four Chapters,1985,7,Rated on 17 Jul 2018,2h,Paul Schrader,"USA,Japan"," Biography, Drama","https://m.media-amazon.com/images/M/MV5BNDM2NWU1NWEtYzBmNC00MDA4LWI2YzQtZTQ1Y2E3NjZhMDJjXkEyXkFqcGdeQXVyNTAyODkwOQ@@._V1_UX182_CR0,0,182,268_AL_.jpg",A fictionalized account in four chapters of the life of celebrated Japanese writer
The Umbrellas of Cherbourg,1964,7,Rated on 13 Aug 2018,1h 31min,Jacques Demy,"France,West Germany"," Drama, Musical, Romance","https://m.media-amazon.com/images/M/MV5BZmMyNzg3MGYtZTllNS00MjVjLWI0NmQtMTZlNzBmZjBjZTZmXkEyXkFqcGdeQXVyMjgyNjk3MzE@._V1_UX182_CR0,0,182,268_AL_.jpg",A young woman separated from her lover by war faces a life-altering decision.
I Confess,1953,7,Rated on 17 Aug 2018,1h 35min,Alfred Hitchcock,"USA,Canada"," Crime, Drama, Thriller","https://m.media-amazon.com/images/M/MV5BYTY0MTJmMmUtNTVkMy00YTBmLWEzNDUtZWQ0Mjc4NzRjZTNhL2ltYWdlL2ltYWdlXkEyXkFqcGdeQXVyNjc1NTYyMjg@._V1_UX182_CR0,0,182,268_AL_.jpg","A priest, who comes under suspicion for murder, cannot clear his name without breaking the seal of the confessional."
Strangers on a Train,1951,8,Rated on 19 Aug 2018,1h 41min,Alfred Hitchcock,USA," Crime, Film-Noir, Thriller","https://m.media-amazon.com/images/M/MV5BNzc5N2ZjNWMtNWVkZi00MzYyLTkxNjYtMzc0NjE0MDFjNGQ0XkEyXkFqcGdeQXVyNjc1NTYyMjg@._V1_UX182_CR0,0,182,268_AL_.jpg",A psychopath forces a tennis star to comply with his theory that two strangers can get away with murder.
Stray Dog,1949,7,Rated on 09 Jul 2018,2h 2min,Akira Kurosawa,Japan," Crime, Drama, Film-Noir, Mystery, Thriller","https://m.media-amazon.com/images/M/MV5BNDVlMTFkYWUtYTU1NC00ZmMzLThkMGItODhlYjJhZWExYjE3XkEyXkFqcGdeQXVyMzAxNjg3MjQ@._V1_UY268_CR12,0,182,268_AL_.jpg","During a sweltering summer, a rookie homicide detective tries to track down his stolen Colt pistol."
The Eyes of Orson Welles,2018,7,Rated on 18 Aug 2018,1h 55min,Mark Cousins,UK, Documentary,"https://m.media-amazon.com/images/M/MV5BOWMzZGI4NjgtZDZlMy00ZTZhLWEyMzItNjlmY2U4Njk4MzcxXkEyXkFqcGdeQXVyMjQ3NzUxOTM@._V1_UX182_CR0,0,182,268_AL_.jpg",Mark Cousins dives deep into the visual world of legendary director and actor
The Life of Oharu,1952,8,Rated on 17 Aug 2018,2h 13min,Kenji Mizoguchi,Japan, Drama,"https://m.media-amazon.com/images/M/MV5BOGMyZDkzNmItYzEzZC00YmJmLWE2ZTItNGRiMGQ5YzA4ZWI1XkEyXkFqcGdeQXVyMTIyNzY1NzM@._V1_UX182_CR0,0,182,268_AL_.jpg",Follows a woman's fight and survival amid the vicissitudes of life and the cruelty of the society.
Loves of a Blonde,1965,8,Rated on 19 Aug 2018,1h 28min,Milos Forman,Czechoslovakia," Comedy, Romance, Drama","https://m.media-amazon.com/images/M/MV5BZmE3ZDIwZDQtZjhhNS00ZmZjLTg4MTQtNzlkMjBkMGZhY2FiXkEyXkFqcGdeQXVyNzEyNjUwMTA@._V1_UX182_CR0,0,182,268_AL_.jpg","A factory manager in rural Czechoslovakia bargains with the army to send men to the area, to boost the morale of his young female workers, deprived of male company since the local boys have..."
