title,year,rating,date_rated,duration,director,country,genre,actors,image,backdrop,summary
Primer,2004,rating rated-7,/iainm/films/diary/for/2021/03/27/,"77 mins  
				
					More details at",Shane Carruth,USA,"drama,thriller,science fiction","Shane Carruth,David Sullivan,Casey Gooden,Anand Upadhyaya,Carrie Crawford,Jay Butler,John Carruth,Juan Tapia,Ashley Warren,Samantha Thomson,Chip Carruth,Delaney Price,Jack Pyland,Keith Bradshaw,Ashok Upadhyaya,Brandon Blagg,Jon Cook,David Joyner,Eric De Soualhat",https://a.ltrbxd.com/resized/film-poster/2/6/8/2/2682-primer-0-230-0-345-crop.jpg?k=99d368a815,https://a.ltrbxd.com/resized/sm/upload/b7/n2/t9/8m/primer-1200-1200-675-675-crop-000000.jpg?k=81a40cc6c8,"Friends and fledgling entrepreneurs invent a device in their garage which reduces the apparent mass of any object placed inside it, but they discover that it has some highly unexpected capabilities - ones that could enable them to do and to have seemingly anything they want. Taking advantage of this unique opportunity is the first challenge they face. Dealing with the consequences is the next."
Camera Buff,1979,rating rated-8,/iainm/films/diary/for/2021/03/27/,"112 mins  
				
					More details at",Krzysztof Kieślowski,Poland,drama,"Jerzy Stuhr,Malgorzata Zabkowska,Ewa Pokas,Stefan Czyzewski,Jerzy Nowak,Tadeusz Bradecki,Marek Litewka,Boguslaw Sobczuk,Krzysztof Zanussi,Andrzej Jurga,Alicja Bienicewicz,Tadeusz Repka,Aleksandra Kisielewska,Wlodzimierz Maciudzinski,Roman Stankiewicz",https://a.ltrbxd.com/resized/film-poster/2/2/9/0/2/22902-camera-buff-0-230-0-345-crop.jpg?k=a1a7940f02,https://a.ltrbxd.com/resized/sm/upload/tq/ej/2m/rm/camera-buff-1200-1200-675-675-crop-000000.jpg?k=33928c7b15,"Filip buys an 8mm movie camera when his first child is born. Because it's the first camera in town, he's named official photographer by the local Party boss. His horizons widen when he is sent to regional film festivals with his first works but his focus on movie making also leads to domestic strife and philosophical dilemmas."
That Cold Day in the Park,1969,rating rated-7,/iainm/films/diary/for/2021/03/27/,"113 mins  
				
					More details at",Robert Altman,"Canada,USA",drama,"Sandy Dennis,Michael Burns,Luana Anders,Michael Murphy,Susanne Benton,Rae Brown,David Garfield,Edward Greenhalgh,Doris Buckinham,Frank Wade,Alicia Ammon,Lloyd Berry,Linda Sorensen",https://a.ltrbxd.com/resized/film-poster/3/1/0/9/3109-that-cold-day-in-the-park-0-230-0-345-crop.jpg?k=4442456b83,https://a.ltrbxd.com/resized/sm/upload/u9/xt/43/f5/that%20cold%20day-1200-1200-675-675-crop-000000.jpg?k=3dd4b8cadc,"Frances Austen, whose well-appointed apartment overlooks a park in Vancouver, one cold day, observes a rain-soaked young man on a park bench whom she assumes is homeless. Hoping to repress her loneliness, Frances invites ‘the boy’ inside her home to get warm and ends up encouraging him to stay. The young man accepts her every hospitality—food, clothes, profuse conversation, and a room of his own. Little does she realize that her guest is not the person he appears to be. Nor, for that matter, is Frances the woman that she appears to be."
