title,year,rating,date_rated,duration,director,country,genre,actors,image,backdrop,summary
Demons 2,1986,rating rated-7,/iainm/films/diary/for/2021/06/05/,"91 mins  
					
						More details at",Lamberto Bava,Italy,"fantasy,horror","David Edwin Knight,Nancy Brilli,Coralina Cataldi-Tassoni,Bobby Rhodes,Asia Argento,Virginia Bryant,Anita Bartolucci,Antonio Cantafora,Luisa Passega,Davide Marotta,Marco Vivio,Michele Mirabella,Lorenzo Gioelli,Lino Salemme,Maria Chiara Sasso,Dario Casalini,Eliana Miglio,Yvonne Fraschetti,Bruno Bilotta,Lamberto Bava,Stefano Molinari,Giovanna Pini,Pascal Persiano,Fabio Poggiali,Lorenzo Flaherty,Marina Loi",https://a.ltrbxd.com/resized/film-poster/2/4/6/1/7/24617-demons-2-0-230-0-345-crop.jpg?k=9cdaadd06b,,A group of tenants and visitors are trapped in a 10-story high-rise apartment building infested with demons who proceed to hunt the dwindling humans down.
Affliction,1997,rating rated-7,/iainm/films/diary/for/2021/06/05/,"114 mins  
					
						More details at",Paul Schrader,"Canada,Japan,USA","drama,thriller,mystery","Nick Nolte,James Coburn,Sissy Spacek,Willem Dafoe,Brigid Tierney,Holmes Osborne,Jim True-Frost,Tim Post,Mary Beth Hurt,Christopher Heyerdahl,Marian Seldes,Brawley Nolte,Janine Theriault,Wayne Robson,Sean McCann,Sheena Larkin,Susan Almgren,Mark Camacho,Eugene Lipinski",https://a.ltrbxd.com/resized/film-poster/3/0/9/8/0/30980-affliction-0-230-0-345-crop.jpg?k=179e2b294b,https://a.ltrbxd.com/resized/sm/upload/kx/p3/2s/7v/affliction-1200-1200-675-675-crop-000000.jpg?k=4271a94298,A small town policeman must investigate a suspicious hunting accident. The investigation and other events result in him slowly disintegrating mentally.
The State I Am In,2000,rating rated-7,/iainm/films/diary/for/2021/06/05/,"106 mins  
					
						More details at",Christian Petzold,Germany,drama,"Julia Hummer,Barbara Auer,Richy Müller,Bilge Bingul,Katharina Schüttler,Günther Maria Halmer,Rogério Jacques,Maria João,Vasco Machado,Noberto Paula,Bernd Tauber,Inka Löwendorf,Manfred Möck,Marc Sönnichsen,Ingrit Dohse,Henriette Heinze",https://a.ltrbxd.com/resized/film-poster/5/1/8/6/1/51861-the-state-i-am-in-0-230-0-345-crop.jpg?k=4e45803d9a,,"With 1970s Germany in the background, this film depicts the story of a family from the “R.A.F. Terrorist” group and their search for a normal life and their inner self."
